{
  "id": 1,
  "townId": 1,
  "name": "SureStay Hotel by Best Western Tehachapi",
  "desc": "A solid deal, popular among thru-hikers.",
  "type": "lodging",
  "subtype": "hotel",
  "geopoint": {
    "latitude": 35.1322589,
    "longitude": -118.4550271
  },
  "osm": {
    "wayId": 82576193,
    "tourism": "motel",
    "website": "https://www.bestwestern.com/en_US/book/tehachapi/hotel-rooms/surestay-hotel-by-best-western-tehachapi/propertyCode.52024.html",
    "phone": "+1-661-822-5591",
    "addr:housenumber": "418",
    "addr:street": "West Tehachapi Boulevard",
    "addr:city": "Tehachapi",
    "addr:state": "CA",
    "internet_access": true
  },
  "attrs": {
    "wifi": true,
    "power": true,
    "shower": true
  },
  "feedback": {
    "comments": [
      {
        "userId": "abc",
        "userName": "janedoe",
        "body": "great coffee",
        "direction": "north",
        "date": "2019-11-20T20:20:39Z"
      },
      {
        "userId": "xyz",
        "userName": "johndoe",
        "body": "hated it",
        "direction": "south",
        "date": "2018-11-20T20:20:39Z"
      }
    ],
    "votes": [
      {
        "userId": "abc",
        "up": true,
        "date": "2019-11-20T20:23:39Z"
      },
      {
        "userId": "xyz",
        "up": false,
        "date": "2018-11-20T20:20:39Z"
      }
    ]
  }
}
